<?xml version="1.0" encoding="UTF-8"?>
<!--
This file is part of Volantis Mobility Server. 

Volantis Mobility Server is free software: you can redistribute it and/or modify
it under the terms of the GNU General Public License as published by
the Free Software Foundation, either version 3 of the License, or
(at your option) any later version.

Volantis Mobility Server is distributed in the hope that it will be useful,
but WITHOUT ANY WARRANTY; without even the implied warranty of
MERCHANTABILITY or FITNESS FOR A PARTICULAR PURPOSE.  See the
GNU General Public License for more details.

You should have received a copy of the GNU General Public License
along with Volantis Mobility Server.  If not, see <http://www.gnu.org/licenses/>. 
-->

<definitions xmlns:xsi="http://www.w3.org/2001/XMLSchema-instance" xmlns="http://www.volantis.com/xmlns/device-repository/policy-definitions" xsi:schemaLocation="http://www.volantis.com/xmlns/device-repository/policy-definitions http://www.volantis.com/schema/device-repository/v3.0/device-policy-definitions.xsd">
    <types>
        <type name="EmulateEmphasisTag">
            <structure>
                <field name="enable">
                    <type>
                        <boolean/>
                    </type>
                </field>
                <field name="prefix">
                    <type>
                        <text/>
                    </type>
                </field>
                <field name="suffix">
                    <type>
                        <text/>
                    </type>
                </field>
                <field name="altTag">
                    <type>
                        <text/>
                    </type>
                </field>
            </structure>
        </type>
    </types>
    <category name="location">
        <policy name="mapdatum">
            <type>
                <selection>
                    <keyword>WGS-84</keyword>
                </selection>
            </type>
        </policy>
    </category>
    <category name="misc" prefix="misc">
        <policy name="wibble">
            <type>
                <selection>
                    <keyword>none</keyword>
                </selection>
            </type>
        </policy>
    </category>
</definitions>
<!--
 ===========================================================================
 Change History
 ===========================================================================
 $Log$

 28-Apr-05	7834/1	matthew	VBM:2005041518 Add support for policy and category definition events in the device repository merge

 ===========================================================================
-->
